{
  "schema_version": "mobile-ai-keyboard.ios-archive.v1",
  "status": "not_proven",
  "evidence_class": "protected_external",
  "candidate": {
    "source_commit": null,
    "artifact_digest": null
  },
  "entitlements": {
    "host": {"app_group": null},
    "extension": {"app_group": null}
  },
  "extension_info": {"requests_open_access": null},
  "privacy_manifests": {
    "host": {"embedded": null, "declares_no_collected_data": null},
    "extension": {"embedded": null, "declares_no_collected_data": null}
  },
  "evidence": null,
  "notes": "Populate only from a protected signed iOS archive inspection. Source manifests and simulator builds do not qualify as archive evidence."
}
